identifier;description;value;
GValue_Window_EPConstr_DoubleClear;GValue of Window with EP ConstructionDoubleClear (default value);0.5;
UValue_Window_EPConstr_DoubleClear;UValue of Window with EP ConstructionDoubleClear (default value);1;
convCoeff_CeilingInt;Convective coefficient of ceiling to zone (default, considering thermal radiation);8;
convCoeff_FloorInt;Convective coefficient of floor to zone (default, considering thermal radiation);5;
convCoeff_RoofExt;Convective coefficient of a surface to ambient air (default);12.5;
convCoeff_WallExt;Convective coefficient of a surface to ambient air (default);12.5;
convCoeff_WallInt;Convective coefficient of wall to zone (default, considering thermal radiation);7;
