identifier;description;value;
convCoeff_CeilingADB;Convective coefficient of a ground contact surface (unused, set to 0);0;
convCoeff_CeilingInt;Convective coefficient of ceiling to zone (default, considering thermal radiation);8;
convCoeff_FloorInt;Convective coefficient of floor to zone (default, considering thermal radiation);5;
convCoeff_RoofExt;Convective coefficient of a surface to ambient air (default);12.5;
convCoeff_WallExt;Convective coefficient of a surface to ambient air (default);12.5;
convCoeff_WallInt;Convective coefficient of wall to zone (default, considering thermal radiation);7;
